{"generado_en": "2026-07-06T00:46:39Z", "kpis": {"contratos_analizados": 50, "valor_total_cop": 23750000000.0, "casos_criticos": 15, "pct_contratacion_directa": 26.0, "n_entidades": 6, "n_proveedores": 15, "n_contratos_sin_departamento": 0, "pct_geolocalizado": 100.0}, "serie_anio_modalidad": [{"anio": 2021, "modalidad": "CONTRATACION_DIRECTA", "n_contratos": 4, "valor_total": 1600000000.0}, {"anio": 2021, "modalidad": "LICITACION_PUBLICA", "n_contratos": 5, "valor_total": 2250000000.0}, {"anio": 2021, "modalidad": "MINIMA_CUANTIA", "n_contratos": 4, "valor_total": 2400000000.0}, {"anio": 2021, "modalidad": "SELECCION_ABREVIADA", "n_contratos": 4, "valor_total": 2000000000.0}, {"anio": 2022, "modalidad": "CONTRATACION_DIRECTA", "n_contratos": 5, "valor_total": 2500000000.0}, {"anio": 2022, "modalidad": "LICITACION_PUBLICA", "n_contratos": 4, "valor_total": 1600000000.0}, {"anio": 2022, "modalidad": "MINIMA_CUANTIA", "n_contratos": 4, "valor_total": 2200000000.0}, {"anio": 2022, "modalidad": "SELECCION_ABREVIADA", "n_contratos": 4, "valor_total": 1800000000.0}, {"anio": 2023, "modalidad": "CONTRATACION_DIRECTA", "n_contratos": 4, "valor_total": 1800000000.0}, {"anio": 2023, "modalidad": "LICITACION_PUBLICA", "n_contratos": 4, "valor_total": 1400000000.0}, {"anio": 2023, "modalidad": "MINIMA_CUANTIA", "n_contratos": 4, "valor_total": 2000000000.0}, {"anio": 2023, "modalidad": "SELECCION_ABREVIADA", "n_contratos": 4, "valor_total": 2200000000.0}], "departamentos": [{"cod_dpto": "11", "dpto": "BOGOTÁ, D.C.", "n_contratos": 8, "valor_total": 3600000000.0, "score_promedio": 60.111111111111114, "n_bajo": 1, "n_medio": 2, "n_alto": 2, "n_criticos": 3}, {"cod_dpto": "13", "dpto": "BOLÍVAR", "n_contratos": 0, "valor_total": 0.0, "score_promedio": null, "n_bajo": 0, "n_medio": 0, "n_alto": 0, "n_criticos": 0}, {"cod_dpto": "15", "dpto": "BOYACÁ", "n_contratos": 0, "valor_total": 0.0, "score_promedio": null, "n_bajo": 0, "n_medio": 0, "n_alto": 0, "n_criticos": 0}, {"cod_dpto": "17", "dpto": "CALDAS", "n_contratos": 0, "valor_total": 0.0, "score_promedio": null, "n_bajo": 0, "n_medio": 0, "n_alto": 0, "n_criticos": 0}, {"cod_dpto": "18", "dpto": "CAQUETÁ", "n_contratos": 0, "valor_total": 0.0, "score_promedio": null, "n_bajo": 0, "n_medio": 0, "n_alto": 0, "n_criticos": 0}, {"cod_dpto": "19", "dpto": "CAUCA", "n_contratos": 0, "valor_total": 0.0, "score_promedio": null, "n_bajo": 0, "n_medio": 0, "n_alto": 0, "n_criticos": 0}, {"cod_dpto": "20", "dpto": "CESAR", "n_contratos": 0, "valor_total": 0.0, "score_promedio": null, "n_bajo": 0, "n_medio": 0, "n_alto": 0, "n_criticos": 0}, {"cod_dpto": "23", "dpto": "CÓRDOBA", "n_contratos": 0, "valor_total": 0.0, "score_promedio": null, "n_bajo": 0, "n_medio": 0, "n_alto": 0, "n_criticos": 0}, {"cod_dpto": "25", "dpto": "CUNDINAMARCA", "n_contratos": 8, "valor_total": 3800000000.0, "score_promedio": 48.78947368421053, "n_bajo": 3, "n_medio": 1, "n_alto": 2, "n_criticos": 2}, {"cod_dpto": "27", "dpto": "CHOCÓ", "n_contratos": 0, "valor_total": 0.0, "score_promedio": null, "n_bajo": 0, "n_medio": 0, "n_alto": 0, "n_criticos": 0}, {"cod_dpto": "41", "dpto": "HUILA", "n_contratos": 0, "valor_total": 0.0, "score_promedio": null, "n_bajo": 0, "n_medio": 0, "n_alto": 0, "n_criticos": 0}, {"cod_dpto": "44", "dpto": "LA GUAJIRA", "n_contratos": 0, "valor_total": 0.0, "score_promedio": null, "n_bajo": 0, "n_medio": 0, "n_alto": 0, "n_criticos": 0}, {"cod_dpto": "47", "dpto": "MAGDALENA", "n_contratos": 0, "valor_total": 0.0, "score_promedio": null, "n_bajo": 0, "n_medio": 0, "n_alto": 0, "n_criticos": 0}, {"cod_dpto": "05", "dpto": "ANTIOQUIA", "n_contratos": 18, "valor_total": 8950000000.0, "score_promedio": 46.76536312849162, "n_bajo": 6, "n_medio": 4, "n_alto": 2, "n_criticos": 6}, {"cod_dpto": "50", "dpto": "META", "n_contratos": 0, "valor_total": 0.0, "score_promedio": null, "n_bajo": 0, "n_medio": 0, "n_alto": 0, "n_criticos": 0}, {"cod_dpto": "52", "dpto": "NARIÑO", "n_contratos": 0, "valor_total": 0.0, "score_promedio": null, "n_bajo": 0, "n_medio": 0, "n_alto": 0, "n_criticos": 0}, {"cod_dpto": "54", "dpto": "NORTE DE SANTANDER", "n_contratos": 0, "valor_total": 0.0, "score_promedio": null, "n_bajo": 0, "n_medio": 0, "n_alto": 0, "n_criticos": 0}, {"cod_dpto": "63", "dpto": "QUINDÍO", "n_contratos": 0, "valor_total": 0.0, "score_promedio": null, "n_bajo": 0, "n_medio": 0, "n_alto": 0, "n_criticos": 0}, {"cod_dpto": "66", "dpto": "RISARALDA", "n_contratos": 0, "valor_total": 0.0, "score_promedio": null, "n_bajo": 0, "n_medio": 0, "n_alto": 0, "n_criticos": 0}, {"cod_dpto": "68", "dpto": "SANTANDER", "n_contratos": 0, "valor_total": 0.0, "score_promedio": null, "n_bajo": 0, "n_medio": 0, "n_alto": 0, "n_criticos": 0}, {"cod_dpto": "70", "dpto": "SUCRE", "n_contratos": 0, "valor_total": 0.0, "score_promedio": null, "n_bajo": 0, "n_medio": 0, "n_alto": 0, "n_criticos": 0}, {"cod_dpto": "73", "dpto": "TOLIMA", "n_contratos": 0, "valor_total": 0.0, "score_promedio": null, "n_bajo": 0, "n_medio": 0, "n_alto": 0, "n_criticos": 0}, {"cod_dpto": "76", "dpto": "VALLE DEL CAUCA", "n_contratos": 16, "valor_total": 7400000000.0, "score_promedio": 42.351351351351354, "n_bajo": 5, "n_medio": 3, "n_alto": 4, "n_criticos": 4}, {"cod_dpto": "08", "dpto": "ATLÁNTICO", "n_contratos": 0, "valor_total": 0.0, "score_promedio": null, "n_bajo": 0, "n_medio": 0, "n_alto": 0, "n_criticos": 0}, {"cod_dpto": "81", "dpto": "ARAUCA", "n_contratos": 0, "valor_total": 0.0, "score_promedio": null, "n_bajo": 0, "n_medio": 0, "n_alto": 0, "n_criticos": 0}, {"cod_dpto": "85", "dpto": "CASANARE", "n_contratos": 0, "valor_total": 0.0, "score_promedio": null, "n_bajo": 0, "n_medio": 0, "n_alto": 0, "n_criticos": 0}, {"cod_dpto": "86", "dpto": "PUTUMAYO", "n_contratos": 0, "valor_total": 0.0, "score_promedio": null, "n_bajo": 0, "n_medio": 0, "n_alto": 0, "n_criticos": 0}, {"cod_dpto": "88", "dpto": "ARCHIPIÉLAGO DE SAN ANDRÉS, PROVIDENCIA Y SANTA CATALINA", "n_contratos": 0, "valor_total": 0.0, "score_promedio": null, "n_bajo": 0, "n_medio": 0, "n_alto": 0, "n_criticos": 0}, {"cod_dpto": "91", "dpto": "AMAZONAS", "n_contratos": 0, "valor_total": 0.0, "score_promedio": null, "n_bajo": 0, "n_medio": 0, "n_alto": 0, "n_criticos": 0}, {"cod_dpto": "94", "dpto": "GUAINÍA", "n_contratos": 0, "valor_total": 0.0, "score_promedio": null, "n_bajo": 0, "n_medio": 0, "n_alto": 0, "n_criticos": 0}, {"cod_dpto": "95", "dpto": "GUAVIARE", "n_contratos": 0, "valor_total": 0.0, "score_promedio": null, "n_bajo": 0, "n_medio": 0, "n_alto": 0, "n_criticos": 0}, {"cod_dpto": "97", "dpto": "VAUPÉS", "n_contratos": 0, "valor_total": 0.0, "score_promedio": null, "n_bajo": 0, "n_medio": 0, "n_alto": 0, "n_criticos": 0}, {"cod_dpto": "99", "dpto": "VICHADA", "n_contratos": 0, "valor_total": 0.0, "score_promedio": null, "n_bajo": 0, "n_medio": 0, "n_alto": 0, "n_criticos": 0}]}